{
  "evidence_id": "WW_ARCH_001",
  "experience_id": "EXP_WW_001",
  "fact": "The locked Winter Walk Master Blueprint defines the OP Recommendation Adoption & Support System as an internal Google Workspace operating tool and explicitly states it is not a CRM, public dashboard, partner ranking system, AI auto-sending tool, or model that proves adoption caused fundraising outcomes.",
  "capabilities": [
    "requirements definition",
    "system scope boundary"
  ],
  "technologies": [
    "Google Workspace"
  ],
  "evidence_state": "SUPPORTED",
  "original_source": "WinterWalk_Master_Blueprint.docx",
  "source_location": "Section 1 Executive Summary — \"What it is not\" (items: Not a CRM; Not a public dashboard; Not a partner ranking or scoring system; Not an AI auto-sending tool; Not a model that proves adoption caused fundraising outcomes)",
  "safe_for_external_use": true,
  "notes": "Design-intent source only. Does not prove that every planned component was implemented or deployed.",
  "limitations": [
    "Does not prove implementation completeness",
    "Does not prove production deployment or daily use"
  ],
  "workflow_stage": "requirements"
}
